{
  "$schema": "https://json-schema.org/draft/2020-12/schema",
  "$id": "https://withbuddi.com/schemas/agent.schema.json",
  "title": "buddi catalogue agent (agents/<name>/agent.json)",
  "description": "Configuration only: nothing here runs. Unknown fields are refused, by the market check and by buddi. `integrity` and `claims` are written by `node scripts/check.mjs --write agent:<name>`; everything else is written by hand.",
  "type": "object",
  "additionalProperties": false,
  "required": [
    "kind", "name", "version", "handle", "title", "pitch", "description", "about",
    "category", "trust", "author", "license", "buddi", "requires", "optional",
    "needs", "tools", "missions", "fills", "examples", "language", "replaces", "changes"
  ],
  "properties": {
    "kind": { "const": "agent" },
    "name": {
      "description": "The agent id and its folder name; unique across plugins and agents in the market.",
      "type": "string", "pattern": "^[a-z][a-z0-9-]{1,39}$"
    },
    "version": {
      "description": "Semver. Any change to the package moves it, with a `changes` line.",
      "type": "string", "pattern": "^(0|[1-9]\\d*)\\.(0|[1-9]\\d*)\\.(0|[1-9]\\d*)(-[0-9A-Za-z.-]+)?$"
    },
    "handle": {
      "description": "The default handle, without the @. buddi picks a free one (chef-2) when it is taken.",
      "type": "string", "pattern": "^[a-z][a-z0-9-]{1,31}$"
    },
    "title": { "type": "string", "minLength": 1, "maxLength": 40 },
    "pitch": { "description": "The card's one line.", "type": "string", "minLength": 1, "maxLength": 120 },
    "description": {
      "description": "The agent file's description: one line other agents read to hand it work.",
      "type": "string", "minLength": 1, "maxLength": 240
    },
    "about": { "description": "Two or three sentences for the detail page.", "type": "string", "minLength": 1, "maxLength": 600 },
    "category": { "enum": ["work", "money", "home", "health", "learning", "life"] },
    "trust": { "description": "By-buddi only in v1.", "const": "by-buddi" },
    "author": {
      "type": "object", "additionalProperties": false, "required": ["name"],
      "properties": {
        "name": { "type": "string", "minLength": 1, "maxLength": 80 },
        "url": { "type": "string", "pattern": "^https://" }
      }
    },
    "license": { "type": "string", "minLength": 1, "maxLength": 60 },
    "buddi": { "description": "The buddi versions it works with, a semver range.", "type": "string", "minLength": 1, "maxLength": 64 },
    "requires": {
      "description": "Plugins that must be installed: listed plugin name → semver range.",
      "type": "object", "additionalProperties": { "type": "string", "minLength": 1, "maxLength": 64 }
    },
    "optional": {
      "description": "Plugins that make it better. A tool ending in ? belongs to one of these.",
      "type": "object", "additionalProperties": { "type": "string", "minLength": 1, "maxLength": 64 }
    },
    "needs": {
      "description": "Requirements that are not plugins. mailbox? is a mailbox that makes it better: its email.* tools then end in ? and hold only while a mailbox is linked.",
      "type": "array", "maxItems": 4, "items": { "enum": ["mailbox", "mailbox?", "image-account"] }
    },
    "tools": {
      "description": "The grant: tool names or family globs, a trailing ? for an optional plugin's. The privilege boundary.",
      "type": "array", "minItems": 1, "maxItems": 64,
      "items": { "type": "string", "pattern": "^[a-z][a-z0-9_]*\\.([a-z][a-z0-9_]*|\\*)\\??$" }
    },
    "missions": {
      "description": "Suggested missions, created off.",
      "type": "array", "maxItems": 6,
      "items": {
        "type": "object", "additionalProperties": false, "required": ["id", "name", "cron", "prompt"],
        "properties": {
          "id": { "type": "string", "pattern": "^[a-z][a-z0-9-]{1,39}$" },
          "name": { "type": "string", "minLength": 1, "maxLength": 60 },
          "cron": { "description": "Five fields, in the owner's timezone.", "type": "string", "pattern": "^\\S+ \\S+ \\S+ \\S+ \\S+$" },
          "prompt": { "type": "string", "minLength": 1, "maxLength": 4000 },
          "misfirePolicy": { "enum": ["replay-all", "coalesce", "latest-only", "skip-after-deadline"] },
          "alwaysDeliver": { "type": "boolean" }
        }
      }
    },
    "fills": {
      "description": "The picks the install sheet asks, each with a default.",
      "type": "array", "maxItems": 6,
      "items": {
        "type": "object", "additionalProperties": false, "required": ["id", "kind", "label"],
        "properties": {
          "id": { "type": "string", "pattern": "^[a-z][a-z0-9-]{1,39}$" },
          "kind": { "enum": ["mailbox", "calendar", "place", "time", "text"] },
          "label": { "type": "string", "minLength": 1, "maxLength": 80 },
          "optional": { "type": "boolean" },
          "mission": { "description": "kind time only: the mission whose hour it sets.", "type": "string", "pattern": "^[a-z][a-z0-9-]{1,39}$" }
        }
      }
    },
    "examples": {
      "description": "Example asks for the detail page and the done screen.",
      "type": "array", "minItems": 3, "maxItems": 3, "items": { "type": "string", "minLength": 1, "maxLength": 120 }
    },
    "language": { "enum": ["mirror", "en", "fr"] },
    "idleRollover": { "enum": ["3h", "1d", "1w", "never"] },
    "roles": {
      "description": "Capabilities it answers for (plugin missions and watchers address roles). By-buddi packages only; anything else carries [].",
      "type": "array", "maxItems": 6, "items": { "type": "string", "pattern": "^[a-z][a-z0-9-]{1,31}$" }
    },
    "replaces": {
      "description": "Older agents this package supersedes, as <source>/<id>.",
      "type": "array", "maxItems": 4, "items": { "type": "string", "pattern": "^[a-z][a-z0-9-]*/[a-z][a-z0-9-]*$" }
    },
    "changes": { "description": "One line for this version.", "type": "string", "minLength": 1, "maxLength": 200 },
    "integrity": { "description": "Written by the check.", "type": "string", "pattern": "^sha256-[A-Za-z0-9+/]{43}=$" },
    "claims": { "description": "Written by the check.", "type": "object" }
  }
}
