{
  "kind": "agent",
  "name": "illustrator",
  "version": "1.0.0",
  "handle": "art",
  "title": "Illustrator",
  "pitch": "Turns a request into one clear picture.",
  "description": "Turns a request into one clear image prompt, makes the picture with the Image plugin, and hands back its library id.",
  "about": "Writes one careful prompt from your request (subject, style, composition, palette, what to avoid) and makes the picture, which lands in your Files. It keeps your house style in mind. It cannot see what it made, so it tells you what it asked for, and it never copies a brand's assets or draws a real person.",
  "category": "work",
  "trust": "by-buddi",
  "author": {
    "name": "withbuddi",
    "url": "https://withbuddi.com"
  },
  "license": "Apache-2.0",
  "buddi": ">=0.1.0-pre.32",
  "requires": {
    "image": ">=0.1.3"
  },
  "optional": {},
  "needs": [
    "image-account"
  ],
  "tools": [
    "image.generate",
    "memory.*"
  ],
  "missions": [],
  "fills": [],
  "examples": [
    "A watercolour of our street in autumn.",
    "An icon for my podcast.",
    "Same picture, wider."
  ],
  "language": "mirror",
  "replaces": [
    "image/illustrator"
  ],
  "changes": "First version: the Image plugin's Illustrator, as a catalogue agent.",
  "integrity": "sha256-ImlRlnNLAbRUi3Wi6jd5olka5z7VJgWKSKEUnqCVzNE=",
  "claims": {
    "tools": [
      {
        "name": "image.generate",
        "plugin": "image",
        "tier": "auto",
        "ownerOnly": false,
        "optional": false
      },
      {
        "name": "memory.forget",
        "plugin": "core",
        "tier": "auto",
        "ownerOnly": false,
        "optional": false
      },
      {
        "name": "memory.get_preferences",
        "plugin": "core",
        "tier": "auto",
        "ownerOnly": false,
        "optional": false
      },
      {
        "name": "memory.note",
        "plugin": "core",
        "tier": "auto",
        "ownerOnly": false,
        "optional": false
      },
      {
        "name": "memory.recall",
        "plugin": "core",
        "tier": "auto",
        "ownerOnly": false,
        "optional": false
      },
      {
        "name": "memory.remember_preference",
        "plugin": "core",
        "tier": "auto",
        "ownerOnly": false,
        "optional": false
      }
    ],
    "missions": [],
    "plugins": {
      "requires": [
        {
          "name": "image",
          "range": ">=0.1.3",
          "listed": "0.1.4",
          "hostApi": "^1.8"
        }
      ],
      "optional": []
    },
    "skills": [
      {
        "file": "writing-an-image-prompt.md",
        "name": "writing-an-image-prompt",
        "description": "How one request becomes one image prompt: subject, style, composition, palette, what to avoid; references; no text unless asked; no brands or real people. Read it before calling image.generate."
      }
    ],
    "avatar": {
      "sha256": "sha256-lS2G3bjVwoFJ9iIqKGX+05zPZXEp669bsa+UDzvbp34=",
      "bytes": 126457,
      "width": 512,
      "height": 512
    },
    "sizes": {
      "persona": 3118,
      "skills": 2700
    }
  }
}
