{
  "kind": "agent",
  "name": "home-manager",
  "version": "1.0.0",
  "handle": "home",
  "title": "Home Manager",
  "pitch": "Keeps the house and car's history: appliances, warranties, service dates, what's due.",
  "description": "Keeps the history of the owner's home and vehicles: appliances and their warranties, repairs and services (when, by whom, for how much), and what is due next.",
  "about": "Remembers what was done to the house and the car, when, by whom and for how much, so a date or a tradesperson's name is one question away. It keeps warranties and service intervals and tells you what is due. It cannot book a repair, pay an invoice or look up a manual for you.",
  "category": "home",
  "trust": "by-buddi",
  "author": {
    "name": "withbuddi",
    "url": "https://withbuddi.com"
  },
  "license": "Apache-2.0",
  "buddi": ">=0.1.0-pre.32",
  "requires": {},
  "optional": {
    "weather": ">=0.1.4"
  },
  "needs": [
    "mailbox?"
  ],
  "tools": [
    "memory.*",
    "reminder.*",
    "schedule.*",
    "owner.notify",
    "artifacts.list",
    "artifacts.describe",
    "artifacts.text",
    "email.search?",
    "email.read?",
    "weather.now?",
    "weather.forecast?"
  ],
  "missions": [
    {
      "id": "monthly-due",
      "name": "What's due this month",
      "cron": "0 9 1 * *",
      "misfirePolicy": "latest-only",
      "prompt": "It is the first of the month. Following your keeping-a-history skill, recall the home and vehicle records you keep and list what falls due this month or is overdue: services, inspections, warranties ending, renewals, seasonal jobs. One line each with the date and the last time it was done. When you have the forecast, add one seasonal line only if it calls for something (frost, a storm, a heatwave). When nothing is due, call mission.silent."
    }
  ],
  "fills": [
    {
      "id": "mailbox",
      "kind": "mailbox",
      "label": "Which mailbox gets your invoices and receipts?",
      "optional": true
    }
  ],
  "examples": [
    "The boiler was serviced today.",
    "When does the dishwasher warranty end?",
    "Frost tonight, anything to do?"
  ],
  "language": "mirror",
  "idleRollover": "1w",
  "replaces": [
    "buddi/keeper"
  ],
  "changes": "First version: Keeper's history-keeping, for the whole home and its vehicles.",
  "integrity": "sha256-ICWVHth4k8wdTK9iVwwEpuGIPQ9O1KD0DGmKPwjT6Xg=",
  "claims": {
    "tools": [
      {
        "name": "memory.forget",
        "plugin": "core",
        "tier": "auto",
        "ownerOnly": false,
        "optional": false
      },
      {
        "name": "memory.get_preferences",
        "plugin": "core",
        "tier": "auto",
        "ownerOnly": false,
        "optional": false
      },
      {
        "name": "memory.note",
        "plugin": "core",
        "tier": "auto",
        "ownerOnly": false,
        "optional": false
      },
      {
        "name": "memory.recall",
        "plugin": "core",
        "tier": "auto",
        "ownerOnly": false,
        "optional": false
      },
      {
        "name": "memory.remember_preference",
        "plugin": "core",
        "tier": "auto",
        "ownerOnly": false,
        "optional": false
      },
      {
        "name": "reminder.cancel",
        "plugin": "core",
        "tier": "auto",
        "ownerOnly": false,
        "optional": false
      },
      {
        "name": "reminder.list",
        "plugin": "core",
        "tier": "auto",
        "ownerOnly": false,
        "optional": false
      },
      {
        "name": "reminder.set",
        "plugin": "core",
        "tier": "auto",
        "ownerOnly": false,
        "optional": false
      },
      {
        "name": "schedule.cancel_mine",
        "plugin": "core",
        "tier": "auto",
        "ownerOnly": false,
        "optional": false
      },
      {
        "name": "schedule.list_mine",
        "plugin": "core",
        "tier": "auto",
        "ownerOnly": false,
        "optional": false
      },
      {
        "name": "schedule.propose",
        "plugin": "core",
        "tier": "gated",
        "ownerOnly": false,
        "optional": false
      },
      {
        "name": "owner.notify",
        "plugin": "core",
        "tier": "auto",
        "ownerOnly": false,
        "optional": false
      },
      {
        "name": "artifacts.list",
        "plugin": "core",
        "tier": "auto",
        "ownerOnly": false,
        "optional": false
      },
      {
        "name": "artifacts.describe",
        "plugin": "core",
        "tier": "auto",
        "ownerOnly": false,
        "optional": false
      },
      {
        "name": "artifacts.text",
        "plugin": "core",
        "tier": "auto",
        "ownerOnly": false,
        "optional": false
      },
      {
        "name": "email.search",
        "plugin": "core",
        "tier": "auto",
        "ownerOnly": false,
        "optional": true
      },
      {
        "name": "email.read",
        "plugin": "core",
        "tier": "auto",
        "ownerOnly": false,
        "optional": true
      },
      {
        "name": "weather.now",
        "plugin": "weather",
        "tier": "auto",
        "ownerOnly": false,
        "optional": true
      },
      {
        "name": "weather.forecast",
        "plugin": "weather",
        "tier": "auto",
        "ownerOnly": false,
        "optional": true
      }
    ],
    "missions": [
      {
        "id": "monthly-due",
        "name": "What's due this month",
        "when": "The first of every month at 09:00",
        "enabled": false
      }
    ],
    "plugins": {
      "requires": [],
      "optional": [
        {
          "name": "weather",
          "range": ">=0.1.4",
          "listed": "0.1.5",
          "hostApi": "^1.18"
        }
      ]
    },
    "skills": [
      {
        "file": "keeping-a-history.md",
        "name": "keeping-a-history",
        "description": "How to record and read back the history of a home and its vehicles so that a date, a name or a cost can be found a year later."
      }
    ],
    "avatar": {
      "sha256": "sha256-A6JBqWI9Ee4oulCP/wTFEskEzj7r4f1sJ0/xFz1KZEM=",
      "bytes": 126317,
      "width": 512,
      "height": 512
    },
    "sizes": {
      "persona": 3102,
      "skills": 1999
    }
  }
}
